{
  "schema_version": "1.0",
  "correlation_id": "corr-mvp-example-0001",
  "recorded_at": "2026-06-06T00:00:00Z",
  "scenario": "service_order_to_activation_mvp_example",
  "capability_slice": "service_order_to_activation/",
  "evidence_label": "demo_evidence",
  "claim_boundary": "Example evidence only; not formal 3GPP, O-RAN, or TM Forum conformance.",
  "inputs": {
    "product_id": "prod-5g-data-basic",
    "order_id": "order-example-0001",
    "service_id": "svc-example-0001",
    "subscriber_id": "subscriber-example-0001"
  },
  "touched_components": [
    {
      "path": "services/catalog_api/",
      "role": "product lookup",
      "evidence_note": "planned MVP component"
    },
    {
      "path": "services/order_engine/",
      "role": "product order lifecycle",
      "evidence_note": "planned MVP component"
    },
    {
      "path": "services/orchestration/",
      "role": "activation graph",
      "evidence_note": "planned MVP component"
    },
    {
      "path": "adapters/3gpp/",
      "role": "mock-core activation boundary",
      "evidence_note": "planned adapter contract"
    }
  ],
  "standards_rows": [
    {
      "standards_body": "TM Forum",
      "spec_id": "TMF620",
      "release_register_path": "traceability/standards_release_register.yaml",
      "conformance_level": "planned functional smoke only",
      "known_gap_to_latest": "formal CTK evidence missing for this MVP path"
    },
    {
      "standards_body": "3GPP",
      "spec_id": "release-baseline",
      "release_register_path": "traceability/standards_release_register.yaml",
      "conformance_level": "mock readiness only",
      "known_gap_to_latest": "formal protocol conformance evidence missing"
    }
  ],
  "artifact_paths": [
    "traceability/evidence_snapshots/example-mvp-evidence-bundle.json"
  ],
  "known_gaps": [
    "No external implementation profile is exercised by this example.",
    "No formal standards conformance is claimed."
  ],
  "next_validation_step": "Replace this example with a bundle generated by the first MVP integration test."
}
