{
  "schema_version": "1.0",
  "correlation_id": "corr-soa-planned-0001",
  "recorded_at": "2026-06-06T00:00:00Z",
  "scenario": "service_order_to_activation_mvp_contract",
  "capability_slice": "service_order_to_activation/",
  "evidence_label": "planned",
  "claim_boundary": "Planned evidence contract only; not formal 3GPP, O-RAN, or TM Forum conformance.",
  "inputs": {
    "product_id": "prod-5g-data-basic",
    "order_id": "order-soa-planned-0001",
    "service_id": "svc-soa-planned-0001",
    "subscriber_id": "subscriber-soa-planned-0001",
    "subscriber_intent": "subscriber=demo-enterprise-001; access=5g-data",
    "session_intent": "dnn=internet; slice=sst-1; qos=best-effort"
  },
  "touched_components": [
    {
      "path": "capabilities/service_order_to_activation/flow-contract.yaml",
      "role": "MVP flow contract",
      "evidence_note": "planned contract for issues 21-25"
    },
    {
      "path": "services/catalog_api/",
      "role": "planned product lookup",
      "evidence_note": "future implementation scope"
    },
    {
      "path": "services/order_engine/",
      "role": "planned product order and activation-plan lifecycle",
      "evidence_note": "future implementation scope"
    },
    {
      "path": "services/orchestration/",
      "role": "planned intent mapping",
      "evidence_note": "future implementation scope"
    },
    {
      "path": "adapters/3gpp/",
      "role": "planned mock-core activation adapter",
      "evidence_note": "future implementation scope"
    }
  ],
  "standards_rows": [
    {
      "standards_body": "TM Forum",
      "spec_id": "TMF620",
      "release_register_path": "traceability/standards_release_register.yaml",
      "conformance_level": "planned functional smoke only",
      "known_gap_to_latest": "formal CTK evidence missing for this MVP path"
    },
    {
      "standards_body": "TM Forum",
      "spec_id": "TMF622",
      "release_register_path": "traceability/standards_release_register.yaml",
      "conformance_level": "planned functional smoke only",
      "known_gap_to_latest": "formal CTK evidence missing for this MVP path"
    },
    {
      "standards_body": "TM Forum",
      "spec_id": "TMF641",
      "release_register_path": "traceability/standards_release_register.yaml",
      "conformance_level": "planned service-order mapping only",
      "known_gap_to_latest": "formal CTK evidence missing"
    },
    {
      "standards_body": "TM Forum",
      "spec_id": "TMF640",
      "release_register_path": "traceability/standards_release_register.yaml",
      "conformance_level": "planned activation reference only",
      "known_gap_to_latest": "implementation and formal evidence missing"
    },
    {
      "standards_body": "3GPP",
      "spec_id": "release-baseline",
      "release_register_path": "traceability/standards_release_register.yaml",
      "conformance_level": "planned mock readiness only",
      "known_gap_to_latest": "formal protocol conformance evidence missing"
    }
  ],
  "artifact_paths": [
    "capabilities/service_order_to_activation/README.md",
    "capabilities/service_order_to_activation/flow-contract.yaml",
    "traceability/evidence_snapshots/service-order-to-activation-planned-evidence-bundle.json"
  ],
  "known_gaps": [
    "No external implementation profile is exercised by this planned contract.",
    "No formal TM Forum CTK result is produced by this planned contract.",
    "No formal 3GPP protocol conformance evidence is produced by this planned contract."
  ],
  "next_validation_step": "Implement issues 21-25 and replace this planned bundle with evidence generated by the MVP integration test."
}
